{
  "initial_state": {
    "properties": [
      {"name": "battery", "value": 100.0},
      {"name": "solarPanelsOpen", "value": false},
      {"name": "isHappy", "value": false}
    ]
  },
  "goal_state": {
    "requirements": [
      {"name": "battery", "value": 80.0, "operator": ">="},
      {"name": "solarPanelsOpen", "value": true, "operator": "=="},
      {"name": "isHappy", "value": true, "operator": "=="}
    ]
  },
  "tasks": [
    {
      "name": "openSolarPanels",
      "duration": 5,
      "requirements": [
        {"name": "solarPanelsOpen", "value": false, "operator": "=="},
        {"name": "battery", "value": 10.0, "operator": ">="}
      ],
      "property_impacts": [
        {"name": "battery", "type": "delta", "value": -10.0},
        {"name": "solarPanelsOpen", "type": "assignment", "value": true},
        {"name": "isHappy", "type": "assignment", "value": false}
      ]
    },
    {
      "name": "closeSolarPanels",
      "duration": 5,
      "requirements": [
        {"name": "solarPanelsOpen", "value": true, "operator": "=="},
        {"name": "battery", "value": 20.0, "operator": ">="}
      ],
      "property_impacts": [
        {"name": "solarPanelsOpen", "type": "assignment", "value": false},
        {"name": "battery", "type": "delta", "value": -10.0}
      ]
    },
    {
      "name": "chargeBattery",
      "duration": 10,
      "requirements": [
        {"name": "solarPanelsOpen", "value": true, "operator": "=="},
        {"name": "battery", "value": 100.0, "operator": "<"}
      ],
      "property_impacts": [
        {"name": "battery", "type": "delta", "value": 10.0}
      ]
    },
    {
      "name": "makeHappy",
      "duration": 15,
      "requirements": [
        {"name": "isHappy", "value": false, "operator": "=="},
        {"name": "battery", "value": 25, "operator": ">="}
      ],
      "property_impacts": [
        {"name": "isHappy", "type": "assignment", "value": true},
        {"name": "battery", "type": "delta", "value": -10.0}
      ]
    }
  ],
  "optimizations": [
    {
      "name": "battery",
      "weight": 0,
      "type": "max"
    }
  ],
  "perturbations": [

  ]
}