{
  "initial_state": {
    "properties": [
      {"name": "speed", "value": 10.0},
      {"name": "doorOpen", "value": true},
      {"name": "Fuel","value":30.0},
      {"name": "wheelHealth", "value":20.0},
      {"name": "wheelsDown", "value": false},
      {"name": "Altitude", "value": 0.0}
    ]
  },
  "goal_state": {
    "requirements": [
      {"name": "speed", "value": 10.0, "operator": "<="},
      {"name": "wheelsDown", "value": true, "operator": "=="},
      {"name": "Fuel","value":70.0, "operator": ">="},
      {"name": "wheelHealth", "value":40.0, "operator": ">"}
    ]
  },
  "tasks": [
    {
      "name" : "Decrease Altitude",
      "duration": 20,
      "requirements":[
        {"name": "Fuel","value":60.0, "operator": ">"},
        {"name": "Altitude", "value":100.0, "operator": "=="}
      ],
      "property_impacts": [
        {"name": "Altitude", "type": "delta","value": -40.0},
        {"name": "Fuel","type": "delta", "value":-60.0}
      ]
    },
    {
      "name" : "Open Door",
      "duration": 10,
      "requirements":[
        {"name": "Fuel","value":30.0, "operator": ">="},
        {"name": "doorOpen", "value":0.0, "operator": "=="}
      ],
      "property_impacts": [
        {"name": "doorOpen", "type": "assignment", "value":true},
        {"name": "Fuel", "type": "delta", "value":-30.0}
      ]
    },
    {
      "name" : "Increase Speed",
      "duration": 100,
      "requirements":[
        {"name": "wheelHealth","value":30.0, "operator": ">="},
        {"name": "Speed", "value":20.0, "operator": "<"}
      ],
      "property_impacts": [
        {"name": "Speed", "type":"assignment", "value":10.0},
        {"name": "wheelHealth", "type": "delta", "value":-10.0}
      ]
    }
  ],
  "optimizations": [
    {
      "name": "wheelHealth",
      "priority": 6,
      "type": "maximization"
    },
    {
      "name": "time",
      "priority": 2,
      "type": "minimization"
    },
    {
      "name": "energy",
      "priority": 1,
      "type": "min"
    }
  ],
  "perturbations": [
    {
      "name" : "Decrease Altitude",
      "time": 320,
      "property_impacts": [
        {"name": "Altitude", "type": "delta", "value":-10.0},
        {"name": "Fuel", "type": "delta", "value":-30.0}
      ]
    },
    {
      "name" : "Increase Spped",
      "time": 1300,
      "property_impacts": [
        {"name": "speed", "type": "assignment", "value":5.0},
        {"name": "wheelHealth", "type": "delta", "value":-5.0}
      ]
    },
    {
      "name" : "Close Door",
      "time": 180,
      "property_impacts": [
        {"name": "doorOpen", "type": "assignment", "value":false},
        {"name": "wheelHealth", "type": "delta", "value":-5.0}
      ]
    },
    {
      "name" : "Speed Up and Charge",
      "time": 320,
      "property_impacts": [
        {"name": "speed", "type": "delta","value":6.0},
        {"name": "Fuel", "type": "delta", "value":10.0}
      ]
    }
  ]
}
