{
  "initial_state": {
    "properties": [
      {"name": "speed", "value": 0.0},
      {"name": "doorOpen", "value": false},
      {"name": "Fuel","value":100.0},
      {"name": "wheelHealth", "value":100.0},
      {"name": "wheelsDown", "value": false},
      {"name": "Altitude", "value": 0.0}
    ]
  },
  "goal_state": {
    "requirements": [
      {"name": "wheelsDown", "value": true, "operator": "=="},
      {"name": "doorOpen", "value": true, "operator": "=="}
    ]
  },
  "tasks": [
    {
      "name" : "Open Door",
      "duration": 20,
      "requirements":[
        {"name": "Fuel","value":60.0, "operator": ">"},
        {"name": "Altitude", "value":0.0, "operator": "=="}
      ],
      "property_impacts": [
        {"name": "doorOpen", "type": "assignment","value": true},
        {"name": "Fuel","type": "delta", "value":-30.0}
      ]
    },
    {
      "name" : "Wheels Down",
      "duration": 30,
      "requirements":[
        {"name": "Fuel","value":60.0, "operator": ">"},
        {"name": "Altitude", "value":0.0, "operator": "=="}
      ],
      "property_impacts": [
        {"name": "wheelsDown", "type": "assignment","value": true},
        {"name": "Fuel","type": "delta", "value":-10.0}

      ]
    }
  ],
  "optimizations": [
    {
      "name": "Fuel",
      "weight": 1.0,
      "type": "maximization"
    }
  ]
}