{
  "initial_state": {
    "properties": [
      {"name": "battery", "value": 100.0},
      {"name": "solarPanelsOpen", "value": false},
      {"name": "isHappy", "value": false},
      {"name": "altitude", "value": 70.0},
      {"name": "doorOpen", "value": false},
      {"name": "dataCollected", "value": 0.0}
    ]
  },
  "goal_state": {
    "requirements": [
      {"name": "battery", "value": 80.0, "operator": ">="},
      {"name": "solarPanelsOpen", "value": true, "operator": "=="},
      {"name": "isHappy", "value": true, "operator": "=="},
      {"name": "altitude", "value": 120.0, "operator": "=="},
      {"name": "dataCollected", "value": 75.0, "operator": ">="},
      {"name": "doorOpen", "value": false, "operator": "=="}
    ]
  },
  "tasks": [
    {
      "name": "openSolarPanels",
      "duration": 5,
      "requirements": [
        {"name": "solarPanelsOpen", "value": false, "operator": "=="},
        {"name": "battery", "value": 10.0, "operator": ">="}
      ],
      "property_impacts": [
        {"name": "battery", "type": "delta", "value": -10.0},
        {"name": "solarPanelsOpen", "type": "assignment", "value": true}
      ]
    },
    {
      "name": "closeSolarPanels",
      "duration": 5,
      "requirements": [
        {"name": "solarPanelsOpen", "value": true, "operator": "=="},
        {"name": "battery", "value": 20.0, "operator": ">="}
      ],
      "property_impacts": [
        {"name": "solarPanelsOpen", "type": "assignment", "value": false},
        {"name": "battery", "type": "delta", "value": -10.0}
      ]
    },
    {
      "name": "chargeBattery",
      "duration": 10,
      "requirements": [
        {"name": "solarPanelsOpen", "value": true, "operator": "=="},
        {"name": "battery", "value": 100.0, "operator": "<"}
      ],
      "property_impacts": [
        {"name": "battery", "type": "delta", "value": 20.0}
      ]
    },
    {
      "name": "makeHappy",
      "duration": 15,
      "requirements": [
        {"name": "isHappy", "value": false, "operator": "=="},
        {"name": "battery", "value": 25, "operator": ">="}
      ],
      "property_impacts": [
        {"name": "isHappy", "type": "assignment", "value": true},
        {"name": "battery", "type": "delta", "value": -20.0}
      ]
    },
    {
      "name": "raiseAltitude10",
      "duration": 20,
      "requirements": [
        {"name": "altitude", "value": 0.0, "operator": ">"},
        {"name": "battery", "value": 25.0, "operator": ">="}
      ],
      "property_impacts": [
        {"name": "altitude", "type": "delta", "value": 10.0},
        {"name": "battery", "type": "delta", "value": -10.0}
      ]
    },
    {
      "name": "openDoor",
      "duration": 5,
      "requirements": [
        {"name": "doorOpen", "value": false, "operator": "=="},
        {"name": "battery", "value": 15.0, "operator": ">="}
      ],
      "property_impacts": [
        {"name": "doorOpen", "type": "assignment", "value": true},
        {"name": "battery", "type": "delta", "value": -5.0}
      ]
    },
    {
      "name": "closeDoor",
      "duration": 5,
      "requirements": [
        {"name": "doorOpen", "value": true, "operator": "=="},
        {"name": "battery", "value": 15.0, "operator": ">="}
      ],
      "property_impacts": [
        {"name": "doorOpen", "type": "assignment", "value": false},
        {"name": "battery", "type": "delta", "value": -5.0}
      ]
    },
    {
      "name": "collectData",
      "duration": 15,
      "requirements": [
        {"name": "doorOpen", "value": true, "operator": "=="},
        {"name": "altitiude", "value": 100.0, "operator": ">="},
        {"name": "battery", "value": 50.0, "operator": ">="}
      ],
      "property_impacts": [
        {"name": "dataCollected", "type": "delta", "value": 15.0},
        {"name": "isHappy", "type": "assignment", "value": false},
        {"name": "battery", "type": "delta", "value": -5.0}
      ]
    }
  ],
  "optimizations": [
    {
      "name": "battery",
      "weight": 0,
      "type": "max"
    }
  ],
  "perturbations": [

  ]
}